{
  "$schema": "factory/platform_instance/schema/platform_instance.schema.json",
  "components": [
    {
      "artifact": {
        "artifact_type": "none",
        "canonical_form": null,
        "digest": null,
        "pinned": false
      },
      "component_id": "authorization",
      "component_version": "0.1.0"
    },
    {
      "artifact": {
        "artifact_type": "none",
        "canonical_form": null,
        "digest": null,
        "pinned": false
      },
      "component_id": "booking",
      "component_version": "0.1.0"
    },
    {
      "artifact": {
        "artifact_type": "none",
        "canonical_form": null,
        "digest": null,
        "pinned": false
      },
      "component_id": "commerce",
      "component_version": "0.2.0"
    },
    {
      "artifact": {
        "artifact_type": "none",
        "canonical_form": null,
        "digest": null,
        "pinned": false
      },
      "component_id": "identity",
      "component_version": "0.4.0"
    },
    {
      "artifact": {
        "artifact_type": "none",
        "canonical_form": null,
        "digest": null,
        "pinned": false
      },
      "component_id": "learning",
      "component_version": "0.3.0"
    },
    {
      "artifact": {
        "artifact_type": "none",
        "canonical_form": null,
        "digest": null,
        "pinned": false
      },
      "component_id": "tenant_authority",
      "component_version": "0.1.0"
    }
  ],
  "configuration": {
    "authorization": {
      "platform_id": "example-platform"
    },
    "booking": {
      "platform_id": "example-platform"
    },
    "commerce": {
      "platform_id": "example-platform"
    },
    "identity": {
      "current_platform_id": "example-platform"
    },
    "learning": {
      "platform_id": "example-platform"
    },
    "tenant_authority": {
      "platform_id": "example-platform"
    }
  },
  "golden_bundle": null,
  "instance_digest": "sha256:477145e4584b47f250a5181bb37aa21adb54c0a36ec58b3770f11f99e83219e9",
  "manifest": {
    "manifest_digest": "sha256:3e391dc7a7300cc2b09a803a141b03ca9f2c9930dc3f2b8c50d702eea625471e",
    "manifest_id": "example-platform",
    "manifest_version": "1.0.0"
  },
  "manifest_state": "validated",
  "platform_id": "example-platform"
}
